10:43:14.618893 IP localhost.53886 > _localdnsstub.domain: 4839+ [1au] A? google.com. (51)
10:43:14.768558 IP _localdnsstub.domain > localhost.53886: 4839 1/0/1 A 216.239.38.120 (55)
10:43:14.792994 IP localhost.35053 > _localdnsstub.domain: 32609+ [1au] A? google.com. (51)
10:43:14.793186 IP _localdnsstub.domain > localhost.35053: 32609 1/0/1 A 216.239.38.120 (55)
10:43:14.816100 IP localhost.56980 > _localdnsstub.domain: 21384+ [1au] A? google.com. (51)
10:43:14.816287 IP _localdnsstub.domain > localhost.56980: 21384 1/0/1 A 216.239.38.120 (55)
10:43:14.839559 IP localhost.46019 > _localdnsstub.domain: 12818+ [1au] A? google.com. (51)
10:43:14.839736 IP _localdnsstub.domain > localhost.46019: 12818 1/0/1 A 216.239.38.120 (55)
10:43:14.862643 IP localhost.52659 > _localdnsstub.domain: 25474+ [1au] A? google.com. (51)
10:43:14.862851 IP _localdnsstub.domain > localhost.52659: 25474 1/0/1 A 216.239.38.120 (55)
10:43:14.885405 IP localhost.35174 > _localdnsstub.domain: 26485+ [1au] A? google.com. (51)
10:43:14.885595 IP _localdnsstub.domain > localhost.35174: 26485 1/0/1 A 216.239.38.120 (55)
10:43:14.910762 IP localhost.53537 > _localdnsstub.domain: 17615+ [1au] A? google.com. (51)
10:43:14.910980 IP _localdnsstub.domain > localhost.53537: 17615 1/0/1 A 216.239.38.120 (55)
10:43:14.934246 IP localhost.46405 > _localdnsstub.domain: 13303+ [1au] A? google.com. (51)
10:43:14.934435 IP _localdnsstub.domain > localhost.46405: 13303 1/0/1 A 216.239.38.120 (55)
10:43:14.957616 IP localhost.42749 > _localdnsstub.domain: 1375+ [1au] A? google.com. (51)
10:43:14.957812 IP _localdnsstub.domain > localhost.42749: 1375 1/0/1 A 216.239.38.120 (55)
10:43:14.980739 IP localhost.35972 > _localdnsstub.domain: 19770+ [1au] A? google.com. (51)
10:43:14.980934 IP _localdnsstub.domain > localhost.35972: 19770 1/0/1 A 216.239.38.120 (55)
10:43:15.005293 IP localhost.51468 > _localdnsstub.domain: 44763+ [1au] A? google.com. (51)
10:43:15.005462 IP _localdnsstub.domain > localhost.51468: 44763 1/0/1 A 216.239.38.120 (55)
10:43:15.031694 IP localhost.59738 > _localdnsstub.domain: 622+ [1au] A? google.com. (51)
10:43:15.031917 IP _localdnsstub.domain > localhost.59738: 622 1/0/1 A 216.239.38.120 (55)
10:43:15.054724 IP localhost.47103 > _localdnsstub.domain: 37184+ [1au] A? google.com. (51)
10:43:15.054928 IP _localdnsstub.domain > localhost.47103: 37184 1/0/1 A 216.239.38.120 (55)
10:43:15.077841 IP localhost.53765 > _localdnsstub.domain: 56865+ [1au] A? google.com. (51)
10:43:15.078024 IP _localdnsstub.domain > localhost.53765: 56865 1/0/1 A 216.239.38.120 (55)
10:43:15.100040 IP localhost.33902 > _localdnsstub.domain: 49557+ [1au] A? google.com. (51)
10:43:15.100223 IP _localdnsstub.domain > localhost.33902: 49557 1/0/1 A 216.239.38.120 (55)
10:43:15.123377 IP localhost.43708 > _localdnsstub.domain: 40736+ [1au] A? google.com. (51)
10:43:15.123552 IP _localdnsstub.domain > localhost.43708: 40736 1/0/1 A 216.239.38.120 (55)
10:43:15.146083 IP localhost.60293 > _localdnsstub.domain: 1978+ [1au] A? google.com. (51)
10:43:15.146257 IP _localdnsstub.domain > localhost.60293: 1978 1/0/1 A 216.239.38.120 (55)
10:43:15.170105 IP localhost.55523 > _localdnsstub.domain: 24073+ [1au] A? google.com. (51)
10:43:15.170283 IP _localdnsstub.domain > localhost.55523: 24073 1/0/1 A 216.239.38.120 (55)
10:43:15.192934 IP localhost.40201 > _localdnsstub.domain: 31366+ [1au] A? google.com. (51)
10:43:15.193113 IP _localdnsstub.domain > localhost.40201: 31366 1/0/1 A 216.239.38.120 (55)
10:43:15.215580 IP localhost.45847 > _localdnsstub.domain: 14992+ [1au] A? google.com. (51)
10:43:15.215758 IP _localdnsstub.domain > localhost.45847: 14992 1/0/1 A 216.239.38.120 (55)
10:43:15.238895 IP localhost.59736 > _localdnsstub.domain: 8118+ [1au] A? google.com. (51)
10:43:15.239075 IP _localdnsstub.domain > localhost.59736: 8118 1/0/1 A 216.239.38.120 (55)
10:43:15.261913 IP localhost.50533 > _localdnsstub.domain: 29296+ [1au] A? google.com. (51)
10:43:15.262090 IP _localdnsstub.domain > localhost.50533: 29296 1/0/1 A 216.239.38.120 (55)
10:43:15.286752 IP localhost.47483 > _localdnsstub.domain: 56889+ [1au] A? google.com. (51)
10:43:15.286947 IP _localdnsstub.domain > localhost.47483: 56889 1/0/1 A 216.239.38.120 (55)
10:43:15.309512 IP localhost.42074 > _localdnsstub.domain: 53495+ [1au] A? google.com. (51)
10:43:15.309692 IP _localdnsstub.domain > localhost.42074: 53495 1/0/1 A 216.239.38.120 (55)
10:43:15.332329 IP localhost.47370 > _localdnsstub.domain: 51124+ [1au] A? google.com. (51)
10:43:15.332505 IP _localdnsstub.domain > localhost.47370: 51124 1/0/1 A 216.239.38.120 (55)
10:43:15.354999 IP localhost.39893 > _localdnsstub.domain: 50644+ [1au] A? google.com. (51)
10:43:15.355179 IP _localdnsstub.domain > localhost.39893: 50644 1/0/1 A 216.239.38.120 (55)
10:43:15.366883 IP localhost.39205 > _localdnsstub.domain: 64524+ [1au] A? google.com. (51)
10:43:15.367055 IP _localdnsstub.domain > localhost.39205: 64524 1/0/1 A 216.239.38.120 (55)
10:43:15.389810 IP localhost.49776 > _localdnsstub.domain: 40427+ [1au] A? google.com. (51)
10:43:15.389986 IP _localdnsstub.domain > localhost.49776: 40427 1/0/1 A 216.239.38.120 (55)
10:43:15.413282 IP localhost.52783 > _localdnsstub.domain: 32769+ [1au] A? google.com. (51)
10:43:15.413469 IP _localdnsstub.domain > localhost.52783: 32769 1/0/1 A 216.239.38.120 (55)
10:43:15.438234 IP localhost.60118 > _localdnsstub.domain: 60803+ [1au] A? google.com. (51)
10:43:15.438420 IP _localdnsstub.domain > localhost.60118: 60803 1/0/1 A 216.239.38.120 (55)
10:43:15.461438 IP localhost.60875 > _localdnsstub.domain: 59489+ [1au] A? google.com. (51)
10:43:15.461619 IP _localdnsstub.domain > localhost.60875: 59489 1/0/1 A 216.239.38.120 (55)
10:43:15.474211 IP localhost.54865 > _localdnsstub.domain: 6556+ [1au] A? google.com. (51)
10:43:15.474391 IP _localdnsstub.domain > localhost.54865: 6556 1/0/1 A 216.239.38.120 (55)
10:43:15.497214 IP localhost.41568 > _localdnsstub.domain: 39413+ [1au] A? google.com. (51)
10:43:15.497395 IP _localdnsstub.domain > localhost.41568: 39413 1/0/1 A 216.239.38.120 (55)
10:43:15.520461 IP localhost.42373 > _localdnsstub.domain: 6586+ [1au] A? google.com. (51)
10:43:15.520646 IP _localdnsstub.domain > localhost.42373: 6586 1/0/1 A 216.239.38.120 (55)
10:43:15.543929 IP localhost.50357 > _localdnsstub.domain: 7873+ [1au] A? google.com. (51)
10:43:15.544108 IP _localdnsstub.domain > localhost.50357: 7873 1/0/1 A 216.239.38.120 (55)
10:43:15.569704 IP localhost.48760 > _localdnsstub.domain: 61118+ [1au] A? google.com. (51)
10:43:15.569903 IP _localdnsstub.domain > localhost.48760: 61118 1/0/1 A 216.239.38.120 (55)
10:43:15.592544 IP localhost.39729 > _localdnsstub.domain: 35375+ [1au] A? google.com. (51)
10:43:15.592725 IP _localdnsstub.domain > localhost.39729: 35375 1/0/1 A 216.239.38.120 (55)
10:43:15.615231 IP localhost.57409 > _localdnsstub.domain: 19430+ [1au] A? google.com. (51)
10:43:15.615407 IP _localdnsstub.domain > localhost.57409: 19430 1/0/1 A 216.239.38.120 (55)
10:43:15.638750 IP localhost.60318 > _localdnsstub.domain: 34589+ [1au] A? google.com. (51)
10:43:15.638951 IP _localdnsstub.domain > localhost.60318: 34589 1/0/1 A 216.239.38.120 (55)
10:43:15.661778 IP localhost.34898 > _localdnsstub.domain: 63684+ [1au] A? google.com. (51)
10:43:15.661984 IP _localdnsstub.domain > localhost.34898: 63684 1/0/1 A 216.239.38.120 (55)
10:43:15.684115 IP localhost.42782 > _localdnsstub.domain: 20315+ [1au] A? google.com. (51)
10:43:15.684289 IP _localdnsstub.domain > localhost.42782: 20315 1/0/1 A 216.239.38.120 (55)
10:43:15.707471 IP localhost.52903 > _localdnsstub.domain: 54089+ [1au] A? google.com. (51)
10:43:15.707662 IP _localdnsstub.domain > localhost.52903: 54089 1/0/1 A 216.239.38.120 (55)
10:43:15.730956 IP localhost.50063 > _localdnsstub.domain: 15185+ [1au] A? google.com. (51)
10:43:15.731131 IP _localdnsstub.domain > localhost.50063: 15185 1/0/1 A 216.239.38.120 (55)
10:43:15.754267 IP localhost.36023 > _localdnsstub.domain: 58426+ [1au] A? google.com. (51)
10:43:15.754651 IP _localdnsstub.domain > localhost.36023: 58426 1/0/1 A 216.239.38.120 (55)
10:43:15.777194 IP localhost.46450 > _localdnsstub.domain: 19432+ [1au] A? google.com. (51)
10:43:15.777371 IP _localdnsstub.domain > localhost.46450: 19432 1/0/1 A 216.239.38.120 (55)
10:43:15.801699 IP localhost.52911 > _localdnsstub.domain: 24316+ [1au] A? google.com. (51)
10:43:15.801902 IP _localdnsstub.domain > localhost.52911: 24316 1/0/1 A 216.239.38.120 (55)
10:43:15.826769 IP localhost.35692 > _localdnsstub.domain: 46163+ [1au] A? google.com. (51)
10:43:15.826987 IP _localdnsstub.domain > localhost.35692: 46163 1/0/1 A 216.239.38.120 (55)
10:43:15.849455 IP localhost.36059 > _localdnsstub.domain: 28115+ [1au] A? google.com. (51)
10:43:15.849650 IP _localdnsstub.domain > localhost.36059: 28115 1/0/1 A 216.239.38.120 (55)
10:43:15.872864 IP localhost.52910 > _localdnsstub.domain: 47302+ [1au] A? google.com. (51)
10:43:15.873057 IP _localdnsstub.domain > localhost.52910: 47302 1/0/1 A 216.239.38.120 (55)
10:43:15.896219 IP localhost.59588 > _localdnsstub.domain: 58268+ [1au] A? google.com. (51)
10:43:15.896417 IP _localdnsstub.domain > localhost.59588: 58268 1/0/1 A 216.239.38.120 (55)
